{"$schema":"../../src/model_drift/schemas/canonical-model.schema.json","analysis":{"status":"complete","unsupportedFeatures":[],"warnings":["Illustrative fixture; not extracted from an SLX artifact."]},"blocks":[{"blockType":"Gain","id":"block:controller/SpeedLoop/Gain","name":"Gain","parameters":{"Gain":{"value":"3.0","valueType":"expression"}},"parent":"controller/SpeedLoop","path":"controller/SpeedLoop/Gain","ports":{"inputs":1,"outputs":1},"reference":null},{"blockType":"Saturation","id":"block:controller/SpeedLoop/Saturation","name":"Saturation","parameters":{"LowerLimit":{"value":"-1","valueType":"expression"},"UpperLimit":{"value":"1","valueType":"expression"}},"parent":"controller/SpeedLoop","path":"controller/SpeedLoop/Saturation","ports":{"inputs":1,"outputs":1},"reference":null}],"configuration":{},"connections":[],"fingerprints":{"configuration":"44136fa355b3678a1146ad16f7e8649e94fb4fc21fe77e8310c060f61caaff8a","interfaces":"344993e649be93017e3991016de3156395d931bb6260fc6b9405f370485c91a8","model":"daea74953beb2ee421706f5630c16a7caee216bd530ef340970f7e1cfffeb804","parameters":"7a2a1b1620d0d3efa39242b16e7d4abc715989666d1fa723125e97fbd59779ec","stateflow":"c1fb438605a38d8c24f190f840f5a294fb1455a037fbb57b0c7ebfbd6d122173","structure":"ab5a9ba3d337150ec03eb4ca5912cd11834a7de0ab82ef11cf53011473a92ec7"},"generator":{"name":"simulink-model-diff-example","strategy":"illustrative-fixture","version":"0.1.0"},"interfaces":{"buses":[],"enablePorts":[],"inports":[{"dataType":"single","dimensions":[1],"direction":"input","id":"interface:inport:VehicleSpeed","maximum":null,"minimum":null,"name":"VehicleSpeed","port":1,"sampleTime":"inherited","unit":"m/s"}],"outports":[],"triggerPorts":[]},"model":{"modelType":"model","name":"controller","rootPath":"controller"},"references":{"dataDictionaries":[],"libraries":[],"models":[],"requirements":[]},"schemaVersion":"0.1.0","source":{"artifact":"models/controller-target.slx","artifactSha256":"1222222222222222222222222222222222222222222222222222222222222222","simulinkRelease":null},"stateflow":{"charts":[],"data":[],"events":[],"junctions":[],"states":[],"transitions":[]},"systems":[]}
