{"$schema":"../../src/model_drift/schemas/canonical-model.schema.json","analysis":{"status":"complete","unsupportedFeatures":[],"warnings":["Illustrative fixture; not extracted from an SLX artifact."]},"blocks":[{"blockType":"Gain","id":"block:controller/SpeedLoop/Gain","name":"Gain","parameters":{"Gain":{"value":"2.5","valueType":"expression"}},"parent":"controller/SpeedLoop","path":"controller/SpeedLoop/Gain","ports":{"inputs":1,"outputs":1},"reference":null}],"configuration":{},"connections":[],"fingerprints":{"configuration":"44136fa355b3678a1146ad16f7e8649e94fb4fc21fe77e8310c060f61caaff8a","interfaces":"9639cfbb33f27103016d660c002df21cd9eee62f14edf944e5e07b27771a053a","model":"5083460a6d655239b0d6b852806d60b6599a641a0aeff4ed63434f1adabbfa19","parameters":"e8d193fad0f5434b6e8a54e9463d390760d4de7441c9108176dc95785dd75f4d","stateflow":"c1fb438605a38d8c24f190f840f5a294fb1455a037fbb57b0c7ebfbd6d122173","structure":"1ffa62b08b4274d7dc71662e4015e731017297c1eea2f401d3abfca8b7835148"},"generator":{"name":"simulink-model-diff-example","strategy":"illustrative-fixture","version":"0.1.0"},"interfaces":{"buses":[],"enablePorts":[],"inports":[{"dataType":"double","dimensions":[1],"direction":"input","id":"interface:inport:VehicleSpeed","maximum":null,"minimum":null,"name":"VehicleSpeed","port":1,"sampleTime":"inherited","unit":"m/s"}],"outports":[],"triggerPorts":[]},"model":{"modelType":"model","name":"controller","rootPath":"controller"},"references":{"dataDictionaries":[],"libraries":[],"models":[],"requirements":[]},"schemaVersion":"0.1.0","source":{"artifact":"models/controller-base.slx","artifactSha256":"1111111111111111111111111111111111111111111111111111111111111111","simulinkRelease":null},"stateflow":{"charts":[],"data":[],"events":[],"junctions":[],"states":[],"transitions":[]},"systems":[]}
